Index,QuestionId,AskerId,AskerName,QuestionTitle,answer_id,AnswererId
671,54050581,6714608,ABCD,"Installed Keras with pip3, but getting the &quot;No Module Named keras&quot; error",54756254,2878244
672,54050581,6714608,ABCD,"Installed Keras with pip3, but getting the &quot;No Module Named keras&quot; error",54050624,9362747
673,57503705,11867828,陳建勤,Is dropout layer still active in a freezed Keras model (i.e. trainable=False)?,57509119,2099607
674,57224353,10938547,Jun Liu,Is my training data set too complex for my neural network?,57230784,7645361
675,57224353,10938547,Jun Liu,Is my training data set too complex for my neural network?,57230594,9155909
676,57224353,10938547,Jun Liu,Is my training data set too complex for my neural network?,57225128,9687785
677,57181551,5989288,Asef,Can I write a keras callback that records and returns the total training time?,57182112,5810950
678,57181551,5989288,Asef,Can I write a keras callback that records and returns the total training time?,57181613,11669446
679,56573515,8316412,Rohan Lekhwani,Calling &quot;fit_generator()&quot; multiple times in Keras,56574742,10371987
680,56573515,8316412,Rohan Lekhwani,Calling &quot;fit_generator()&quot; multiple times in Keras,56574714,349130
681,56317060,1191087,golmschenk,Disabling `@tf.function` decorators for debugging?,57166582,887802
682,56317060,1191087,golmschenk,Disabling `@tf.function` decorators for debugging?,56317268,5154274
683,55906129,9772204,lmz,"Difference between &quot;Dropout&quot;, &quot;Monte-Carlo Dropout&quot;, &quot;Channel-wise Dropout&quot;",55907407,5154274
684,54634884,6637138,Evgeny Karpov,Extremely slow training speed with Keras when using steps_per_epoch argument,54635905,2097240
685,58109257,4426009,Hamid Heydarian,How convolutional layer filter size affects input length and how to keep labels the same size,58109542,2097240
686,57481869,3854476,Solomonoff&#39;s Secret,How to serialize data in example-in-example format for tensorflow-ranking?,57533931,4936825
687,57481869,3854476,Solomonoff&#39;s Secret,How to serialize data in example-in-example format for tensorflow-ranking?,57481870,3854476
688,57174019,7766024,Seankala,What exactly is a Variable in TensorFlow and why do we use them?,57180209,1782792
689,57174019,7766024,Seankala,What exactly is a Variable in TensorFlow and why do we use them?,57176796,2455494
690,56519029,6458245,Goldname,Why do I need to compile and fit a pretrained model in Keras?,56524030,349130
691,56519029,6458245,Goldname,Why do I need to compile and fit a pretrained model in Keras?,56519198,3250829
692,56519029,6458245,Goldname,Why do I need to compile and fit a pretrained model in Keras?,56519107,11588671
693,56267652,2359080,addcolor,Is it required to have predefined Image size to use transfer learning in tensorflow?,56269642,1621414
694,56064458,2443944,piccolo,Tensorflow2.0 training: model.compile vs GradientTape,56065444,9393102
695,55749195,4051544,Mike Gashler,How does one feed latent variables into a TensorFlow graph?,55749219,5154274
696,55749195,4051544,Mike Gashler,How does one feed latent variables into a TensorFlow graph?,55749325,1782792
697,55746170,7274157,Imperator123,How to stack Convolutional Layer and LSTM using Tensorflow2.0 alpha?,55750340,5069957
698,55746170,7274157,Imperator123,How to stack Convolutional Layer and LSTM using Tensorflow2.0 alpha?,55750397,1410665
699,55437278,3753287,lifeisshubh,Inner most dimension of an Array,55437297,11015427
700,55437278,3753287,lifeisshubh,Inner most dimension of an Array,55437296,3753287
701,55328355,6239947,Supratim Haldar,Keras flow_from_directory() read only from selected sub-directories,55328610,3987085
702,55262614,7779411,caissalover,How to save and load selected and all variables in tensorflow 2.0 using tf.train.Checkpoint?,57730914,1782792
703,55262614,7779411,caissalover,How to save and load selected and all variables in tensorflow 2.0 using tf.train.Checkpoint?,55263788,5600318
704,55159789,1179925,mrgloom,Tensorflow: how to view checkpoint in tensorboard?,55160098,1179925
705,55147097,3319713,Blue482,tensor conversion function numpy() doesn&#39;t work within tf.estimator model function,55147364,5786339
706,55018167,7703497,Pishang Ujeniya,One Category Text Classification on imbalanced data-set,55018576,10886420
707,54847380,11107475,Ronan Venkat,ImportError: cannot import name &#39;keras&#39;,54847442,9110909
708,54847380,11107475,Ronan Venkat,ImportError: cannot import name &#39;keras&#39;,54847478,4685471
709,54758940,336920,B Seven,Why doesn&#39;t validation_freq work with Keras model fit?,54759167,8112138
710,54559566,10843767,John Gadsden,How to change python version in Anaconda?,56477400,9973203
711,54559566,10843767,John Gadsden,How to change python version in Anaconda?,54559749,8726146
712,54523822,2723224,aveevu,Best way to process terabytes of data on gcloud ml-engine with keras,54523859,5495381
713,54495298,6714608,ABCD,Keras: how to get predicted labels for more than two classes,54495476,5495381
714,54441603,10709127,tuffy chow,"Tensorflow error &quot;has type list, but expected one of: int, long, float&quot;",54442327,9393102
715,54369602,2890590,Mark,tensorflow - how to build operations using tensor names?,54370372,992432
716,54369602,2890590,Mark,tensorflow - how to build operations using tensor names?,54370971,10968882
717,54210128,3161801,ffejrekaburb,Tensorflow text_generation,54210177,10915600
718,54197424,5052482,Jash Shah,How do we create a block (reusable set of functions) in Keras?,54197569,1868775
719,54197424,5052482,Jash Shah,How do we create a block (reusable set of functions) in Keras?,54197576,3991470
720,54014076,4371768,julka,"pip search finds tensorflow, but pip install does not",54014249,841994
721,58013244,11713857,dereks,Why doesn&#39;t `tf.matmul` work with transposed tensor?,58014641,2036766
722,58013244,11713857,dereks,Why doesn&#39;t `tf.matmul` work with transposed tensor?,58014154,10418086
723,58013244,11713857,dereks,Why doesn&#39;t `tf.matmul` work with transposed tensor?,58014072,1782792
724,57937097,347484,Boppity Bop,Is it possible to validate a deep learning model by training small data subset?,57937143,3653343
725,57937097,347484,Boppity Bop,Is it possible to validate a deep learning model by training small data subset?,57937219,2160809
726,57715248,6249001,Daniel Zapata,TensorFlow: Help creating a serving input function,57930130,6249001
727,57715248,6249001,Daniel Zapata,TensorFlow: Help creating a serving input function,57776691,3325672
728,57642361,7748163,skytree,How to initialize the variables of the existing Keras Models?,57643045,2097240
729,57353429,260826,user260826,Install TensorFlow on R,57360473,443806
730,57117397,11499783,Pidem,TensorRT and Tensorflow 2,57262484,11499783
731,57117397,11499783,Pidem,TensorRT and Tensorflow 2,57253604,8474650
732,57117397,11499783,Pidem,TensorRT and Tensorflow 2,57220729,3411080
733,57090420,11801882,Gust,How to assign tf.Variables using placeholders?,57091380,1782792
734,57090420,11801882,Gust,How to assign tf.Variables using placeholders?,57090600,6265630
735,56916313,11718632,Will,Tensorflow 2.0 doesn&#39;t compute the gradient,56917148,9393102
736,56865344,11733048,Toby Peterken,How do I calculate the matthews correlation coefficient in tensorflow,57002007,10685311
737,56865344,11733048,Toby Peterken,How do I calculate the matthews correlation coefficient in tensorflow,56875660,2455494
738,56831972,5368083,bluesummers,TensorFlow concatenate/stack N tensors interleaving last dimensions,56834995,1466792
739,56831972,5368083,bluesummers,TensorFlow concatenate/stack N tensors interleaving last dimensions,56833142,7059474
740,56728337,9364931,michael0196,Implement Causal CNN in Keras for multivariate time-series prediction,56798349,2097240
741,56688744,7713497,Pratik Kumar,unable to import Metric from tensorflow.keras.metrics,56689123,4790871
742,56337100,2163392,mad,The input to a flatten layer must be a tensor,56338066,8625500
743,56232389,4332075,Gaurav Gupta,Why ImageDataGenerator is iterating forever?,56232612,4917205
744,56192908,2184122,Robert Lugg,"TensorFlow Extended (TFX): Clarify Beam, Airflow and Kubeflow usage",57161708,7721459
745,56047834,906835,severian,Tensorflow: &quot;staggered&quot; sequence mask from indices?,56048253,5154274
746,56015171,5430317,zeeshan nisar,Repeat an array over channels,56015320,7579547
747,55989102,10092506,Ngoc Minh Tran,Computing weights in linear regression problem,55989744,423926
748,55944874,4947590,Joy Mazumder,How to multiply each row of a 3D matrix with each element of another 3D matrix on tensorflow?,55947159,2956066
749,55904997,5652313,Jindřich,Pytorch equivalent of `tf.reverse_sequence`?,55906989,3607203
750,55749899,4975860,Nafis S.,Training a simple model in Tensorflow GPU slower than CPU,55750666,5154274
751,55749899,4975860,Nafis S.,Training a simple model in Tensorflow GPU slower than CPU,55750078,7259671
752,55740550,5046896,GoingMyWay,"Tensorflow, iterate tensors",55744637,1803124
753,55701663,2961244,pentadecagon,Input images with dynamic dimensions in Tensorflow-lite,55732431,4789373
754,55688621,1435046,beginh,How to apply mask to a tensor and keep its original shape,55688792,5154274
755,55638989,8807447,tk338,Eager tf.GradientTape() returns only Nones,55639871,5154274
756,55634133,7622324,Omer Lubin,"Can not squeeze dim[1], expected a dimension of 1, got 2",55634744,2099607
757,55634133,7622324,Omer Lubin,"Can not squeeze dim[1], expected a dimension of 1, got 2",55634686,7469434
758,55629163,1093333,Jayesh,Shape of tensor,55629310,10127761
759,55629163,1093333,Jayesh,Shape of tensor,55629354,1849998
760,55629163,1093333,Jayesh,Shape of tensor,55629272,11339311
761,55561540,9301213,Ayush Aggarwal,keras model.get_weight is not returning results in expected dimensions,55561583,5154274
762,55534572,7560008,MerklT,Setting the hidden state for each minibatch with different hidden sizes and multiple LSTM layers in Keras,55548066,423926
763,55502800,3259896,SantoshGupta7,How to add/change names of components to an existing Tensorflow Dataset object?,55543102,1735003
764,55469601,4985990,Giri Annamalai M,Increase sigmoid prediction output values?,55472056,5154274
765,55469601,4985990,Giri Annamalai M,Increase sigmoid prediction output values?,55470205,10868996
766,55459087,1576254,ikamen,Tensorflow 2.0: Optimizer.minimize (&#39;Adam&#39; object has no attribute &#39;minimize&#39;),55460177,5786339
767,55332669,6059213,TomLeung,&#39;Sequential&#39; object has no attribute &#39;loss&#39; - When I used GridSearchCV to tuning my Keras model,55333036,9047837
768,55286731,10344561,Stefano Mazzocchi,What is the recommended way to mix TensorFlow and TensorFlow Federated code?,55287468,11137398
769,55246749,7152553,eshanrh,Why does Google Colab give a &quot;unknown device&quot; error when I try to convert Keras MLP?,55324533,11250738