Index,QuestionId,AskerId,AskerName,QuestionTitle,answer_id,AnswererId
442,55324762,11037865,Rstynbl,The added layer must be an instance of class Layer. Found: &lt;tensorflow.python.keras.engine.input_layer.InputLayer object at 0x000001FA104CBB70&gt;,55325491,5597718
443,54775246,2230045,Spen,Slice every item except every nth,54775632,2956066
444,54775246,2230045,Spen,Slice every item except every nth,54775402,4983450
445,54775246,2230045,Spen,Slice every item except every nth,54775435,7077050
446,54577083,7374225,Max_Hasan,Cannot connect to X server GOOGLE COLAB,58355452,8497354
447,54577083,7374225,Max_Hasan,Cannot connect to X server GOOGLE COLAB,56800018,9481613
448,54577083,7374225,Max_Hasan,Cannot connect to X server GOOGLE COLAB,54579413,10953776
449,54519309,7248145,christk,Split .tfrecords file into many .tfrecords files,54519940,1782792
450,54145072,4729764,GRS,"Changing states of Keras stateful RNN model, layers and methods after creating an Estimator",54254570,10886420
451,54145072,4729764,GRS,"Changing states of Keras stateful RNN model, layers and methods after creating an Estimator",54214506,5884955
452,57662781,930254,MAltakrori,cannot install tensorflow-text using pip despite having tensorflow 2.0.0-beta1 installed,57663358,2650249
453,56615277,7212365,zihaozhihao,Why does this operation execute faster on CPU than GPU?,56616543,867889
454,56298564,2259468,EngrStudent,Autofilter for Time Series in Python/Keras using Conv1d,56498324,9794742
455,55780123,11006135,Bhushan Jagtap,Import tensorflow failed with Error no attribute &#39;HIDDEN_ATTRIBUTE&#39;,55786265,7114624
456,55780123,11006135,Bhushan Jagtap,Import tensorflow failed with Error no attribute &#39;HIDDEN_ATTRIBUTE&#39;,55953396,7569024
457,55780123,11006135,Bhushan Jagtap,Import tensorflow failed with Error no attribute &#39;HIDDEN_ATTRIBUTE&#39;,55811865,5287913
458,55645953,3084689,jaqqz,Shape of tensorflow dataset data in keras (tensorflow 2.0) is wrong after conversion from np array,55647075,2891324
459,54824768,1150683,Bram Vanroy,RNN model (GRU) of word2vec to regression not learning,54895171,10886420
460,54416322,10242641,mht,"expected ndim=3, found ndim=2",54416792,5825953
461,57891504,7327257,M. Merida-Floriano,Tensorflow: fill tensor inside a function,57891832,1782792
462,55834790,1654930,Phate,ImageDataGenerator: how to add the 4th dimension to a numpy array?,55836426,2956066
463,55834790,1654930,Phate,ImageDataGenerator: how to add the 4th dimension to a numpy array?,55834882,5154274
464,55764694,7469434,IonicSolutions,How to use gradient_override_map in Tensorflow 2.0?,55799378,3574081
465,55683348,8078072,Jingnan Lai,tf.keras.Model.predict and call return different result,55683915,10921263
466,55680101,11255365,qinlong,"tensorflow 2.0, when calling the function two variables given, but, when defining the function, there is no variables",55680232,9483495
467,55193486,10133610,WilliamsM,Tensorflow object detection next steps,55196020,1621414
468,55060736,583464,George,tensorflow 2 api regression tensorflow.python.framework.ops.EagerTensor&#39; object is not callable,55150833,2966061
469,55010794,239879,Shamoon,How can I compute class weights for an output that has 4 neurons with keras?,55102059,10886420
470,55010794,239879,Shamoon,How can I compute class weights for an output that has 4 neurons with keras?,55100676,2097240
471,55010794,239879,Shamoon,How can I compute class weights for an output that has 4 neurons with keras?,55070106,6901690
472,55010794,239879,Shamoon,How can I compute class weights for an output that has 4 neurons with keras?,55069764,366553
473,54865717,3861775,Samuel,Tensorflow: Crop largest central square region of image,54866162,9883438
474,54865717,3861775,Samuel,Tensorflow: Crop largest central square region of image,54866705,2641587
475,54865717,3861775,Samuel,Tensorflow: Crop largest central square region of image,54866398,1782792
476,54543510,5920668,I-was-a-Ki,Inplementation of LSTM in Keras,54546582,3302563
477,54543510,5920668,I-was-a-Ki,Inplementation of LSTM in Keras,54543738,3987085
478,54543510,5920668,I-was-a-Ki,Inplementation of LSTM in Keras,54543654,2161778
479,54479770,72583,Jakub Arnold,Is it ok to call `tape.watch(x)` when `x` is already a `tf.Variable` in TensorFlow?,54481232,1782792
480,54427551,4877104,maccN,How to preprocess training set for VGG16 fine tuning in Keras?,54427721,5495381
481,54232426,1492229,asmgx,cannot install tensorflow on anaconda,54233963,7730044
482,54232426,1492229,asmgx,cannot install tensorflow on anaconda,54233151,3572842
483,54196149,4850133,Nikita Makarov,How to use indices from tf.nn.top_k with tf.gather_nd?,54197366,1782792
484,54151981,1273987,Ziofil,Why does AdamOptimizer seem not apply the correct gradient?,54152233,5763590
485,54069363,2084944,Tik0,Output multiple losses added by add_loss in Keras,55025570,7405530
486,54069363,2084944,Tik0,Output multiple losses added by add_loss in Keras,54109533,2084944
487,58096095,12118244,RobGMSN,How does tf.audio.decode_wav get its contents?,58097046,5786339
488,57414387,11541912,Michaela,Meaning of tf.keras.layers.LSTM parameters,57422682,1699075
489,57318930,8946701,Abid Orucov,calculating the number of parameters of a GRU layer (Keras),57321065,7389608
490,56977277,11766668,kitty,Default Adam optimizer doesn&#39;t work in tf.keras but string `adam` does,56977650,5668710
491,56977277,11766668,kitty,Default Adam optimizer doesn&#39;t work in tf.keras but string `adam` does,56977623,5298937
492,56851298,9328846,edn,tensorboard - tensorflow.python.framework.errors_impl.NotFoundError:,56851524,9328846
493,56137353,9039646,DINA TAKLIT,"Cannot feed value of shape (100, 1) for Tensor &#39;input/Y:0&#39;, which has shape &#39;(?,)&#39;",56175272,9039646
494,55863106,10870968,Alex Deft,How to build this custom layer in Keras?,55865378,9565342
495,55863106,10870968,Alex Deft,How to build this custom layer in Keras?,55863568,349130
496,55829593,1587329,serv-inc,Convert output of retrain.py to tensorflow.js,56340746,1587329
497,55829593,1587329,serv-inc,Convert output of retrain.py to tensorflow.js,55830563,5069957
498,55734820,3236215,IVR,Running simple regression in base Tensorflow 2.0,55735643,5154274
499,55572607,10345968,peter bence,What is the difference between tf-nightly-gpu and tensorflow-gpu,55572687,453616
500,55569181,11277304,Sophie Crommelinck,Why is accuracy from fit_generator different to that from evaluate_generator in Keras?,56276963,9849170
501,55569181,11277304,Sophie Crommelinck,Why is accuracy from fit_generator different to that from evaluate_generator in Keras?,55574447,11277304
502,55569181,11277304,Sophie Crommelinck,Why is accuracy from fit_generator different to that from evaluate_generator in Keras?,55570856,8625500
503,55442053,1435046,beginh,"Keras custom layer not returning weights, unlike normal layer",55442663,5154274
504,55442053,1435046,beginh,"Keras custom layer not returning weights, unlike normal layer",55442298,5499527
505,55324643,433570,eugene,how to upgrade tensorflow after installing it using conda?,56693739,11390620
506,55281836,7540723,Hajdu G&#225;bor,Tensorflow with c++ per_process_gpu_memory_fraction not working,55337033,2604336
507,55181222,11190642,Yusuf Altıparmak,How to make tensorflow object detection faster-r cnn model work on Android?,55184293,2641587
508,55094952,10726895,pranav,Understanding Tensorflow control dependencies,55099970,1782792
509,55085487,82898,T.R.,"What is &quot;valency&quot;, with regards to machine learning?",55350042,2540707
510,54953856,2547172,Vaibhav,"Getting error &#39;File &quot;&lt;frozen importlib._bootstrap&gt;&quot;, line 968, in _find_and_load&#39; while importing tensorflow",54953886,7131757
511,54540018,2243184,physicist,What does tensorflow&#39;s tables_initializer do?,54540460,1782792
512,54476186,4345719,johni07,Tensorflow / Keras mean image subtraction,54477107,2641587
513,54432394,6919063,Jacob B,Keras getting different results with set seed,54446073,5884955
514,54432394,6919063,Jacob B,Keras getting different results with set seed,54447439,6919063
515,54199284,4541944,Isaac,"Filter by index and flattened in numpy, like tf.sequence_mask",54199566,9698684
516,54199284,4541944,Isaac,"Filter by index and flattened in numpy, like tf.sequence_mask",54199509,4932316
517,54122837,9134476,Roshni Amber,Retrain a saved model in Keras that was trained using train_on_batch(),54125540,9134476
518,58001456,1917160,Artem Mavrin,TensorFlow Keras &#39;accuracy&#39; metric under the hood implementation,58001684,1917160
519,57999225,567620,ely,How to access sample weights in a Keras custom loss function supplied by a generator?,58599783,4867484
520,57999225,567620,ely,How to access sample weights in a Keras custom loss function supplied by a generator?,58002329,2097240
521,57925061,1519955,Pop,How can I reduce the number of CPUs used by Tensorlfow/Keras?,57933374,5597718
522,57925061,1519955,Pop,How can I reduce the number of CPUs used by Tensorlfow/Keras?,57926618,8234169
523,57786303,6878758,Kalpit,Custom metric for Semantic segmentation,58301761,6878758
524,57771706,12010696,Hans-Ulrich Rudel,Why is accuracy and loss staying exactly the same while training?,57775320,12010696
525,57771706,12010696,Hans-Ulrich Rudel,Why is accuracy and loss staying exactly the same while training?,57772330,8563649
526,57616698,3736306,yuqli,tensorflow pass numpy array to graph using placeholder vs tf.convert_to_tensor(),57625380,3987085
527,57616698,3736306,yuqli,tensorflow pass numpy array to graph using placeholder vs tf.convert_to_tensor(),57625264,10878733
528,57396212,5535604,Anton,SageMaker and TensorFlow 2.0,57796296,9074534
529,57396212,5535604,Anton,SageMaker and TensorFlow 2.0,57517194,11530462
530,57180479,3201721,VinceDMG,Tensorflow serving OOMKilled or Evicted pod with Kubernetes,57288305,3201721
531,56899105,4958717,dsalaj,How to use regularizer argument in tf.get_variable?,56899286,3214872
532,56898069,7655027,Hassam,How to use tensorflow-hub module with tensorflow-dataset api,56902653,2455494
533,56897557,1886357,eric,Tensorflow record: how to read and plot image values?,56932321,5140223
534,56897557,1886357,eric,Tensorflow record: how to read and plot image values?,56930307,11666391
535,56762433,1419123,pythOnometrist,Keras: Share a layer of weights across Training Examples (Not between layers),56773975,5118431
536,56762433,1419123,pythOnometrist,Keras: Share a layer of weights across Training Examples (Not between layers),56768563,5298937
537,56746191,1133286,solvingPuzzles,"Why are the matrices in BERT called Query, Key, and Value?",56819096,7059474
538,56690465,7886651,I. A,Is keras based on closures in python?,56691467,5668710
539,56690465,7886651,I. A,Is keras based on closures in python?,56693530,1440565
540,56616151,5113410,Douglas Rehm,Remove values from a tensor that are within a given range,56616210,4909087
541,56580538,4788501,Josef Korbel,TF keras API with TF dataset problem - steps_per_epoch argument problem,56755637,4788501
542,56575293,11640774,s0x,Validation loss is lower than training loss training LSTM,56575745,6117017
543,56438154,11597209,Playergod,Convert Keras model to C,56438210,11478354
544,56404956,5856770,viru,Adding consecutive elements across dimension in tensorflow,56411207,4255553
545,56340103,10929548,Newo,Does image file type matter in terms of accuracy or speed when training/evaluating in machine learning?,56341569,2455494
546,56168830,10168321,Xeyes,How to reduce a neural network output when a certain action isn&#39;t performable,56225354,5228890
547,55865891,1447953,Ben Farmer,Optimise function for many pseudodata realisations in TensorFlow 2,55923875,1447953
548,55771134,4727788,Ryan Lehmkuhl,Dynamic Activation Function in Keras,55772168,7389608
549,55727760,7105492,Claudio Davi,How fix &#39;The given object is not an Optimizer instance&#39; when using Tensorflow-2.0 tf.optimizers?,55747451,5154274
550,55727760,7105492,Claudio Davi,How fix &#39;The given object is not an Optimizer instance&#39; when using Tensorflow-2.0 tf.optimizers?,55734337,7105492
551,55727760,7105492,Claudio Davi,How fix &#39;The given object is not an Optimizer instance&#39; when using Tensorflow-2.0 tf.optimizers?,55731662,11374868
552,55682941,10227526,LinTIna,How to debug keras in tensorflow 2.0?,55685145,2891324
553,55663594,10378403,Sun Tianyi,ValueError: setting an array element with a sequence. On Keras model.fit,55663750,2653663
554,55583130,1050648,HuckleberryFinn,Tensorflow 2.0 Keras Model subclassing,55589529,5154274
555,55518033,6617195,KKK,Where can I find tensorflow.contrib.layers for TensorFlow 2.0,55524156,867889
556,55518033,6617195,KKK,Where can I find tensorflow.contrib.layers for TensorFlow 2.0,55518399,5154274
557,55518033,6617195,KKK,Where can I find tensorflow.contrib.layers for TensorFlow 2.0,55518654,5652313
558,55491846,6791416,psj,Keras - How to get time taken by each layer in training?,55492933,4755954
559,55464511,11295709,Kirill Kalash,Deploying tensorflow model to GCP without docker,55480034,328036
560,55321864,11249772,Ivan Lorusso,AttributeError: The layer has never been called and thus has no defined input shape,55570803,10886420
561,55244579,10463548,Trevor Stewart,Group tensorflow dataset by key and batch by key,55245628,1782792
562,55161550,583464,George,valuerror attemp to convert a value (type model) to a tensor,55172149,2966061
563,55116477,6691064,vikash singh,Getting exception while using tf.placeholder in TensorFlow,55116616,3090511
564,54981462,9999035,Ram Shanker G,Converting Keras model as tensorflow model gives me error,54997427,10921263
565,54819947,8413477,Mr. Nobody,Defining custom gradient as a class method in Tensorflow,54825044,1782792
566,54819947,8413477,Mr. Nobody,Defining custom gradient as a class method in Tensorflow,54824695,1373669
567,54723912,3861775,Samuel,Tensorflow: Extracting image and label from TFRecords file,54725258,2641587
568,54723912,3861775,Samuel,Tensorflow: Extracting image and label from TFRecords file,54725298,5786339
569,54688502,11061454,jan,neural network does not learn (loss stays the same),54688983,2097240
570,54668364,11055762,DylanG,TensorFlow import data for linear regression,54675285,11055762
571,54668364,11055762,DylanG,TensorFlow import data for linear regression,54673843,5786339
572,54235468,10311158,Moritz,Android TensorFlow Lite interpreter: How to fix &quot;DataType error: cannot resolve DataType of java.lang.Float&quot;,54236953,9883438
573,54194053,9565342,NShiny,"AttributeError: Layer has no inbound nodes, or AttributeError: The layer has never been called",54194436,1462770
574,54072496,6488190,junkmaster,Explaining CNN (Keras) outputs with LIME,54706978,6488190
575,54072496,6488190,junkmaster,Explaining CNN (Keras) outputs with LIME,54074266,6341510
576,58171081,3851047,Marko Karbevski,Tensorflow custom layer: Creating a sparse matrix with trainable parameters,58223071,9828197
577,58137816,12131586,user12131586,using tensorflow inside docker with gpu,58167401,9218240
578,58043843,2155179,jessica,Installing Keras/Tensor Flow on R,58044175,4752675
579,57721324,11768065,drfilip,Is it possible to specify scalar plot colours on Tensorboard?,57721344,9273406
580,57709398,4227746,m.i.n.a.r.,Using simple models on Google Trends data to predict something doesn&#39;t work as expected,57713462,3190076
581,57483565,5272461,Ali Gadimi,Regression with convnet on image using keras - accuracy can&#39;t increase more than 40%,57486429,11162165
582,57483565,5272461,Ali Gadimi,Regression with convnet on image using keras - accuracy can&#39;t increase more than 40%,57484069,11919358
583,57483565,5272461,Ali Gadimi,Regression with convnet on image using keras - accuracy can&#39;t increase more than 40%,57483618,10023182
584,57387169,11893504,user11893504,Getting the diagonal elements of only part of a Tensor,57390091,1782792
585,57304185,11867828,陳建勤,Keras custom loss function (elastic net),57320969,2099607
586,57240208,5531816,Stanley,How to substract two tensor with mask in Tensorflow?,57241492,5810950
587,57236922,9845070,SuperHihi,What does reshape on an image actually do?,57237613,11522398
588,57187710,11831676,Jo37,Decorating with @tf.function changes if condition output,57196156,2455494
589,56981200,6642021,Howard Wang,Flattening tuple of images in tensorflow dataset,56982760,2455494
590,56936189,10748773,I. Schubert,Reparametrization in tensorflow-probability: tf.GradientTape() doesn&#39;t calculate the gradient with respect to a distribution&#39;s mean,56943289,5140223
591,56928928,7776975,itachi737,TensorFlow Keras Custom Callbacks on_test_begin doesn&#39;t override itself,56929322,5495304
592,56888781,7484435,Alex Yefimov,Tensorflow NotFoundError: libtensorflow_framework.so: cannot open shared file or directory,57511296,5879698
593,56888781,7484435,Alex Yefimov,Tensorflow NotFoundError: libtensorflow_framework.so: cannot open shared file or directory,57510739,11869182
594,56779949,888624,Chris,Unable to go from tf.keras model -&gt; quantized frozen graph -&gt; .tflite with TOCO,56841250,888624
595,56722720,2544048,DrkStr,Trouble loading model after Post-training quantisation,56814309,6642182
596,56681738,8512669,Leow,how to use for loop in tensorflow/keras when using tf.keras functional API?,56685250,2455494
597,56554988,6997665,learner,How to instantiate a neural network parameter with tensor?,56555213,921729
598,56433993,7934786,sariii,Getting error while adding embedding layer to lstm autoencoder,56490468,1699075
599,56370298,10609482,PC9494,How do I write a Tensorflow custom op containing a persistent C++ object?,56386085,10609482
600,56291918,2680707,Ricardo Cruz,TensorFlow: slicing tensor with a list using placeholders,56295402,1782792
601,56133254,626537,clstaudt,UnboundLocalError when fitting neural network - TensorFlow bug?,56134710,867889
602,56096120,5349476,John M.,What does DeepLab&#39;s --train_crop_size actually do?,56277186,10951310
603,56096120,5349476,John M.,What does DeepLab&#39;s --train_crop_size actually do?,56106652,867889
604,56093768,4025960,Green678,Tensorflow (1.13.1) Exception when import: DLL load failed (Windows 10),57516724,11127923
605,56088294,11484456,Jianing,tf.keras.models.Sequential model cannot fit with input type tf.Tensor,56088890,2455494
606,56059078,988709,tidy,What happens if tf.stop_gradient is not set?,56115214,1621414
607,56014361,10092506,Ngoc Minh Tran,Differences between Numpy and TensorFlow,57966175,11530462
608,55883795,7133431,xabdax,trainable_variables attribute of the custom layer in Keras returns empty list,55883947,5154274
609,55677827,5807031,LingxB,Loop over tensor dimension 0 (NoneType) with second tensor values,55680074,5154274
610,55652981,3187403,gpernelle,TensorFlow 2.0: How to update tensors?,55653651,5154274
611,55531944,9929884,Silicon,How to restrict tensorflow GPU memory usage?,55532954,7093741
612,55258859,9186974,Sayan Mandal,How to freeze a keras model with custom keras layers(.h5) to tensorflow graph(.pb)?,56641409,1427424
613,55258859,9186974,Sayan Mandal,How to freeze a keras model with custom keras layers(.h5) to tensorflow graph(.pb)?,55261401,2641587
614,55251319,2647513,user2647513,Tensorflow initialization gives all ones,55253250,7389608
615,55242278,7034613,DsCpp,Tensorflow - trainable variable does not change over time,55258518,1782792
616,55176818,5368083,bluesummers,How to support masking in custom tf.keras.layers.Layer,55201406,5368083
617,55155847,3466910,Ivan Vegner,"Tensorflow cannot get gradient wrt a Variable, but can wrt a Tensor",55191828,5786339
618,55062375,583464,George,tensorflow api 2.0 tensor objects are only iterable when eager execution is enabled. To iterate over this tensor use tf.map_fn,55087846,1234909
619,55058591,4688722,Ammar Ul Hassan,tensorflow.python.framework.errors_impl.InternalError: Dst tensor is not initialized,55126192,4688722
620,55049208,8372455,HenryHub,Error in loading the model with load_weights in Keras,55132331,9140084
621,55049208,8372455,HenryHub,Error in loading the model with load_weights in Keras,55055310,11065347
622,54808519,11096006,B4ckup,Optimize GPU usage of tf.map_fn,54810006,1782792
623,54745903,11078155,Michel Cevzar,How to implement an image(2D array) sequence sliding window in tensorflow?,54810574,11096626
624,54686895,1782553,Jav,Tensorflow dilation behave differently than morphological dilation,56391638,5023986
625,54686895,1782553,Jav,Tensorflow dilation behave differently than morphological dilation,55204699,7328782
626,54558464,2796123,deepAgrawal,Pad a tensor by a weight with tensorflow in Python,54570477,1782792
627,54516973,1984680,minerals,Is it possible to create custom Tensorflow GRU/LSTM cell?,54521518,10787274
628,54316729,10952448,Dariusz,Extremely long time (over 10 minutes) to load TensorRT-optimized TensorFlow graphs from .pb file,54766643,10952448
629,54274074,6195861,Kevin,Selecting columns from 3D tensor according to a 1D tensor of indices (Tensorflow),54275240,7389608
630,54176051,5865579,jason,"InvalidArgumentError indices[i,0] = x is not in [0, x) in keras",54177129,1462770
631,54132288,10895943,Gabriel Garcia,Why model.predict() from tensorflowjs always return same prediction?,54138016,5069957
632,54088172,4977634,qwesdfok,why tensorflow throws &quot;The graph couldn&#39;t be sorted in topological order&quot;?,54120941,9862053
633,54004948,4153034,Martin,Consequences of Keras running out of memory,54005497,5986252
634,57759635,3694044,Harald,Get Gradients with Keras Tensorflow 2.0,57834801,931303
635,57675242,10449967,包乔奔,How does tf.function works when two functions call each other,57704523,2455494
636,57539273,8419797,Daniel Casares,Disable Tensorflow logging completely,57719030,1801968
637,57539273,8419797,Daniel Casares,Disable Tensorflow logging completely,57546746,8419797
638,57417089,11208496,tusker,How can a tensor in tensorflow be sliced ​using elements of another array as an index?,57417183,3987085
639,57417089,11208496,tusker,How can a tensor in tensorflow be sliced ​using elements of another array as an index?,57417714,1782792
640,56939282,4790871,David Parks,How do you feed a tf.data.Dataset dynamically in eager execution mode where initializable_iterator isn&#39;t available?,56980166,4790871
641,56655103,5597531,Atr Cheema,How to insert certain values at certain indices of a tensor in tensorflow?,56656216,3987085
642,56457726,10897543,Olfway,Why does Tensorflow cast int32/int32 to float64 and how to stop it?,56492671,1782792
643,55842256,11351605,tre95,How to find out the correct input and output operation of a frozen tensorflow graph?,55898638,11351605
644,55763690,11384432,H.Gruber,Tensorflow Serving Predict REST API &#39;not formatted correctly for base64 data&#39; Error,55782767,11384432
645,55762759,4556387,cjs,How to fix &quot;module &#39;tensorflow&#39; has no attribute &#39;estimator&#39; &quot; error,55928076,4556387
646,55579930,11328673,Ali Ghofrani,Is there any Capsnet Implementation on CIFAR10 that achieve better accuracy than common CNN?,58247597,11329409
647,55048373,4688722,Ammar Ul Hassan,"ValueError: cannot reshape array of size 235000 into shape (100,64,64,2350)",55056065,7389608
648,54802328,880783,bers,Why am I getting different values between loss functions and metrics in TensorFlow Keras?,56303351,880783
649,54346263,4406595,thebeancounter,tensorflow gradient - getting all nan values,54389788,4406595
650,55970686,6510273,Florida Man,Tensorboard not found as magic function in jupyter,58441272,11147295
651,55970686,6510273,Florida Man,Tensorboard not found as magic function in jupyter,55970819,5154274
652,57605741,4699994,Rafay Khan,Convolutional Net Model not working on very simple data,57606215,10455493
653,57605741,4699994,Rafay Khan,Convolutional Net Model not working on very simple data,57606712,10001536
654,57254879,9371809,Helga Holmestad,Saving model history on google cloud storage,57267486,9371809
655,57254879,9371809,Helga Holmestad,Saving model history on google cloud storage,57262437,7674214
656,57254879,9371809,Helga Holmestad,Saving model history on google cloud storage,57255166,10722885
657,56366435,4537989,KillianC,Tensorflow giving random answers on a regression problem,56396289,6904782
658,56366435,4537989,KillianC,Tensorflow giving random answers on a regression problem,56367229,1487756
659,56110234,4283218,Ke Yang,&quot;Dimensions must match&quot; error in tflite conversion with toco,56126139,4283218
660,56110234,4283218,Ke Yang,&quot;Dimensions must match&quot; error in tflite conversion with toco,56128324,2292767
661,56110234,4283218,Ke Yang,&quot;Dimensions must match&quot; error in tflite conversion with toco,56125347,2292767
662,56110234,4283218,Ke Yang,&quot;Dimensions must match&quot; error in tflite conversion with toco,56118077,2292767
663,55402551,9400421,Viziionary,Why am I getting the error &quot;tf.fromPixels is not a function&quot;?,55402747,11086438
664,55005432,9929884,Silicon,Is there some way to save best model only with tensorflow.estimator.train_and_evaluate()?,55010988,3595278
665,55005432,9929884,Silicon,Is there some way to save best model only with tensorflow.estimator.train_and_evaluate()?,55006289,5786339
666,54613474,2110869,reubenjohn,Tensorflow Keras Input layer does not add _keras_shape,54613931,8112138
667,54613474,2110869,reubenjohn,Tensorflow Keras Input layer does not add _keras_shape,54613529,3769033
668,54122211,3314143,daniel451,TensorFlow Graph to Keras Model?,54408366,10787274
669,54122211,3314143,daniel451,TensorFlow Graph to Keras Model?,54406849,2641587
670,54050581,6714608,ABCD,"Installed Keras with pip3, but getting the &quot;No Module Named keras&quot; error",54051014,6858244
