Index,QuestionId,AskerId,AskerName,QuestionTitle,answer_id,AnswererId
219,55170460,6835329,Ameer Taweel,Neural network for square (x^2) approximation,55203161,4685471
220,56657993,11667181,ILM91,How to create a keras layer with a custom gradient in TF2.0?,56658149,5668710
221,55870127,10025471,&#214;mer &#199;iftci,Module &#39;tensorflow&#39; has no attribute &#39;contrib&#39;,57630944,11968821
222,55870127,10025471,&#214;mer &#199;iftci,Module &#39;tensorflow&#39; has no attribute &#39;contrib&#39;,57629649,5838180
223,55870127,10025471,&#214;mer &#199;iftci,Module &#39;tensorflow&#39; has no attribute &#39;contrib&#39;,55879831,10025471
224,55870127,10025471,&#214;mer &#199;iftci,Module &#39;tensorflow&#39; has no attribute &#39;contrib&#39;,55872941,11127923
225,54440859,9251158,miguelmorin,Eager execution in Tensorflow 2,54440944,5884955
226,55007886,3601960,joshwa,Save a model for TensorFlow Serving with api endpoint mapped to certain method using SignatureDefs?,55161668,3214872
227,54129098,2942412,Pranjal,Getting wrong prediction after loading a saved model,58332439,353308
228,54129098,2942412,Pranjal,Getting wrong prediction after loading a saved model,54216210,2942412
229,54129098,2942412,Pranjal,Getting wrong prediction after loading a saved model,54189819,8593338
230,54083955,5865579,jason,Should I use the standalone Keras library or tf.keras?,54117754,5495381
231,54502101,3776738,user3776738,Tensorflow-Deeplearning - Correlation between input and output,55423380,4023951
232,54212645,7826511,Artur M&#252;ller Romanov,How to configure tensorflow legacy/train.py model.cpk output interval,54376718,6154067
233,55533413,11277304,Sophie Crommelinck,How to select strategy to reduce overfitting?,55827001,11277304
234,55533413,11277304,Sophie Crommelinck,How to select strategy to reduce overfitting?,55543516,1967571
235,55318626,3604079,Hadi Rasekh,module &#39;tensorflow&#39; has no attribute &#39;logging&#39;,55318851,3604079
236,54255431,9277245,Ankish Bansal,InvalidArgumentError: cannot compute MatMul as input #0(zero-based) was expected to be a float tensor but is a double tensor [Op:MatMul],54255819,10921263
237,55421984,1653453,Ivan,Batch Normalization in tf.keras does not calculate average mean and average variance,57032720,11774761
238,55421984,1653453,Ivan,Batch Normalization in tf.keras does not calculate average mean and average variance,55442167,5786339
239,56820327,3604079,Hadi Rasekh,The name tf.Session is deprecated. Please use tf.compat.v1.Session instead,56820328,3604079
240,54200850,1559515,dhas,AttributeError: &#39;tuple&#39; object has no attribute &#39;type&#39; upon importing tensorflow,54526899,4943504
241,54200850,1559515,dhas,AttributeError: &#39;tuple&#39; object has no attribute &#39;type&#39; upon importing tensorflow,54397819,4767645
242,54200850,1559515,dhas,AttributeError: &#39;tuple&#39; object has no attribute &#39;type&#39; upon importing tensorflow,54227655,4549682
243,54200850,1559515,dhas,AttributeError: &#39;tuple&#39; object has no attribute &#39;type&#39; upon importing tensorflow,54227633,1973192
244,56507941,3552418,spacegoliath,How to trigger a python function inside a tf.keras custom loss function?,56508898,3552418
245,55925283,11406244,nadia,what is the difference between conv2d and Conv2D in Keras?,55930169,7201397
246,55256671,10715858,Andriy Rizhiy,How to install latest cuDNN to conda?,58350707,9905223
247,55256671,10715858,Andriy Rizhiy,How to install latest cuDNN to conda?,55647174,10887384
248,55256671,10715858,Andriy Rizhiy,How to install latest cuDNN to conda?,55285589,7492218
249,54881627,3041068,dontloo,"in tensorflow, how do I convert a list of indices to an indicator vector?",54882564,1373669
250,55299995,7431458,Burton2000,Exporting a frozen graph .pb file in Tensorflow 2,58040632,7679261
251,55299995,7431458,Burton2000,Exporting a frozen graph .pb file in Tensorflow 2,56597079,9257252
252,57253841,988709,tidy,from_logits=True and from_logits=False get different training result for tf.losses.CategoricalCrossentropy for UNet,57335132,2097240
253,57253841,988709,tidy,from_logits=True and from_logits=False get different training result for tf.losses.CategoricalCrossentropy for UNet,57304538,1714410
254,57253841,988709,tidy,from_logits=True and from_logits=False get different training result for tf.losses.CategoricalCrossentropy for UNet,57288223,11669446
255,56860180,9328846,edn,Tensorflow CUDA - CUPTI error: CUPTI could not be loaded or symbol could not be found,57592360,11125723
256,56860180,9328846,edn,Tensorflow CUDA - CUPTI error: CUPTI could not be loaded or symbol could not be found,56879016,9328846
257,56860180,9328846,edn,Tensorflow CUDA - CUPTI error: CUPTI could not be loaded or symbol could not be found,56862642,11731732
258,56557587,6700151,0spirit0,Why my one-filter convolutional neural network is unable to learn a simple gaussian kernel?,56558128,5368083
259,56557587,6700151,0spirit0,Why my one-filter convolutional neural network is unable to learn a simple gaussian kernel?,56557876,9393102
260,57930073,3954958,Fariborz Ghavamian,Keras Batchnormalization and sample weights,58051800,3954958
261,57930073,3954958,Fariborz Ghavamian,Keras Batchnormalization and sample weights,57983037,8788960
262,57930073,3954958,Fariborz Ghavamian,Keras Batchnormalization and sample weights,57967151,7454706
263,57812324,4396475,mpotma,Saving and loading multiple models with the same graph in TensorFlow Functional API,57832610,5140223
264,55926841,1352749,clifgray,"Convolving Across Channels in Keras CNN: Conv1D, Depthwise Separable Conv, CCCP?",56360396,8625500
265,55380219,4789373,FalconUA,Is tf.GradientTape in TF 2.0 equivalent to tf.gradients?,57602660,11530462
266,55761337,7758413,evaleria,module &#39;tensorflow.python.keras.api._v2.keras.layers&#39; has no attribute &#39;CuDNNLSTM&#39;,56772187,2455494
267,55432963,6842947,Ujjwal,A simple case of Graph visualization in TensorFlow 2.0,55433676,5154274
268,56730261,7934786,sariii,how to reshape text data to be suitable for LSTM model in keras,56880427,7934786
269,56730261,7934786,sariii,how to reshape text data to be suitable for LSTM model in keras,56838482,5094841
270,54586412,2904830,Elliot Robert,"Executing tensorflow python3 on remote server, subprocess can&#39;t interpret all of tensorflows input args. ImportError: No module named &#39;scripts&#39;",54640799,2904830
271,55224016,3468778,Amin Merati,ImportError: libcublas.so.10.0: cannot open shared object file: No such file or director,57193223,86294
272,55224016,3468778,Amin Merati,ImportError: libcublas.so.10.0: cannot open shared object file: No such file or director,56625572,10443041
273,55224016,3468778,Amin Merati,ImportError: libcublas.so.10.0: cannot open shared object file: No such file or director,55989946,5440132
274,55224016,3468778,Amin Merati,ImportError: libcublas.so.10.0: cannot open shared object file: No such file or director,55782472,3355803
275,55224016,3468778,Amin Merati,ImportError: libcublas.so.10.0: cannot open shared object file: No such file or director,55238537,3468778
276,54814113,4183914,lin,Invalid format string Tensorboard,54997112,8491761
277,54814113,4183914,lin,Invalid format string Tensorboard,54897238,11122636
278,54029556,8217561,Con,How to fix &quot;RuntimeError: Missing implementation that supports: loader&quot; when calling hub.text_embedding_column method?,54074674,3343339
279,55261785,9557357,Alda,NVidia drivers stopped working on AWS EC2 instance with Ubuntu 16.04 and Tesla K80 GPU,55388082,5150690
280,55261785,9557357,Alda,NVidia drivers stopped working on AWS EC2 instance with Ubuntu 16.04 and Tesla K80 GPU,55263365,11232572
281,57518057,226526,Kristopher Ives,How can I convert an image from pixels to one-hot encodings?,57568704,5140223
282,57518057,226526,Kristopher Ives,How can I convert an image from pixels to one-hot encodings?,57563310,1190882
283,56382500,373655,rob,Calculate recall for each class after each epoch in Tensorflow 2,56485026,423926
284,56382500,373655,rob,Calculate recall for each class after each epoch in Tensorflow 2,56461830,1735003
285,56382500,373655,rob,Calculate recall for each class after each epoch in Tensorflow 2,56382882,2154440
286,56357851,11210476,Alex,What is the difference between TF 2.0 Alpha and TF nightly preview?,56358348,2891324
287,55496289,10724050,Alice,How to fix &quot;AttributeError: module &#39;tensorflow&#39; has no attribute &#39;get_default_graph&#39;&quot;?,56427511,10651990
288,55496289,10724050,Alice,How to fix &quot;AttributeError: module &#39;tensorflow&#39; has no attribute &#39;get_default_graph&#39;&quot;?,55497342,10724050
289,55496289,10724050,Alice,How to fix &quot;AttributeError: module &#39;tensorflow&#39; has no attribute &#39;get_default_graph&#39;&quot;?,55496390,9032957
290,55081911,10595337,Tawej,Tensorflow 2.0.0-alpha0: tf.logging.set_verbosity,55086116,5154274
291,55081911,10595337,Tawej,Tensorflow 2.0.0-alpha0: tf.logging.set_verbosity,55082119,5786339
292,56961856,11762082,Javier,How to write to TensorBoard in TensorFlow 2,56961915,5668710
293,56690089,9820369,Colin Steidtmann,How to graph tf.keras model in Tensorflow-2.0?,56698035,2891324
294,56690089,9820369,Colin Steidtmann,How to graph tf.keras model in Tensorflow-2.0?,56690364,4909087
295,56276627,8244247,Joseph Budin,How to raise an exception for a tensorflow out of memory error,56276956,8150685
296,54823475,9744785,ptamas90,Tensorflow Object Detection - Convert .pb file to tflite,54862759,7699679
297,56195865,4561745,PrasannaDate,Tensorflow Placeholders vs Tensorflow Constants vs Numpy Arrays,56197481,9393102
298,56195865,4561745,PrasannaDate,Tensorflow Placeholders vs Tensorflow Constants vs Numpy Arrays,56196298,867889
299,54888445,11118883,Bekaert L,How can i use tensorflow object detection to only detect persons?,54929080,1621414
300,54196469,4948889,Jaffer Wilson,Tensorflow predict the class of output,54240210,5495381
301,55917327,1439305,h22,Why does TensorFlow recommends the &quot;functional style for constructing operations&quot;?,55917645,817643
302,57704771,880783,bers,Inputs to eager execution function cannot be Keras symbolic tensors,57707690,880783
303,56963060,1217998,Souradeep Nanda,Keras: What is the difference between model and layers?,56964960,349130
304,56963060,1217998,Souradeep Nanda,Keras: What is the difference between model and layers?,56964033,367273
305,56801148,5116025,Orest Xherija,Unexpected results with CuDNNLSTM (instead of LSTM) layer,56911404,7454706
306,56684040,8531487,Sai Raghuram Kaligotla,Does TensorFlow.js use the GPU for computations?,56684875,2455494
307,55924331,4352606,Tai Christian,How to apply Guided BackProp in Tensorflow 2.0?,56039605,8346078
308,55210684,5748367,Bobson Dugnutt,Feature-wise scaling and shifting (FiLM layer) in Keras,55220399,5748367
309,55141076,7169491,himanshurawlani,How to apply data augmentation in TensorFlow 2.0 after tfds.load(),55598136,10886420
310,54025104,7886651,I. A,How to retrieve examples from multiple tfrecords in tensorflow while using initializable iterator,54082831,7886651
311,57581670,7934786,sariii,how can I get top smallest tensor values based on a condition in tensorflow,57583348,8380272
312,55650121,9163366,cnash,How to implement a custom keras layer that only keeps the top n values and zeros out all the rest?,55651144,5154274
313,55434004,2366849,Adam Hodgson,Create a custom federated data set in TensorFlow Federated,55462901,14692
314,55133700,5865579,jason,How to transfer the following tensorflow code into pytorch,55191819,7805917
315,54805568,10922166,Mob,Too Much Memory Issue with Semantic Image Segmentation NN (DeepLabV3+),54924192,10951310
316,54374956,3987085,gorjan,Tensorflow: Replicating dynamic_rnn behaviour with raw_rnn,54382598,1803124
317,57827274,11731187,ElPapi42,Keras Autoencoder: Tying Weights from Encoder To Decoder not working,57833267,5140223
318,57827274,11731187,ElPapi42,Keras Autoencoder: Tying Weights from Encoder To Decoder not working,57828731,9393102
319,56263870,11541245,Marcin Kozłowski,How to rewrite a tensorflow graph to use CPU for all operations,56269928,4462831
320,55181044,9636774,Utsav Patel,Keras Custom Layer: ValueError: An operation has `None` for gradient,55431517,9636774
321,55181044,9636774,Utsav Patel,Keras Custom Layer: ValueError: An operation has `None` for gradient,55198619,5786339
322,54912571,2965599,Andrew Cassidy,ML Engine Batch Prediction running on wrong python version,56343354,2965599
323,56689337,2544048,DrkStr,Quantization-aware training in Tensorflow using the highlevel keras api,56799631,10668553
324,55392100,8493740,polmonroig,Install Tensorflow 2.0 in conda enviroment,58591933,3017342
325,55392100,8493740,polmonroig,Install Tensorflow 2.0 in conda enviroment,58221449,5931672
326,55392100,8493740,polmonroig,Install Tensorflow 2.0 in conda enviroment,56604176,6394698
327,55392100,8493740,polmonroig,Install Tensorflow 2.0 in conda enviroment,55392567,10580541
328,55392100,8493740,polmonroig,Install Tensorflow 2.0 in conda enviroment,55392433,402079
329,55178230,433570,eugene,What is the difference between keras and tf.keras?,55178699,2891324
330,55178230,433570,eugene,What is the difference between keras and tf.keras?,55178567,3197668
331,57985406,11332292,Christophorus Reyhan,Cannot import name &#39;tf_utils&#39; when using importing keras,58521094,12262626
332,57985406,11332292,Christophorus Reyhan,Cannot import name &#39;tf_utils&#39; when using importing keras,57985905,11332292
333,55268762,9673730,Mark.F,How to accumulate gradients for large batch sizes in Keras,56946898,6055798
334,55268762,9673730,Mark.F,How to accumulate gradients for large batch sizes in Keras,55281501,9673730
335,54347963,2378622,HelpASisterOut,&#39;tf&#39; is not defined on load_model() - using lambda,57062863,7846405
336,54347963,2378622,HelpASisterOut,&#39;tf&#39; is not defined on load_model() - using lambda,54348035,5495381
337,54347963,2378622,HelpASisterOut,&#39;tf&#39; is not defined on load_model() - using lambda,54348075,6280540
338,54614299,139150,shantanuo,Tensor object has no attribute keras_shape,58628399,12226012
339,54614299,139150,shantanuo,Tensor object has no attribute keras_shape,54628352,10809912
340,54093424,7611029,tehtea,Why is TensorFlow Lite slower than TensorFlow on desktop?,54137730,606314
341,54231440,8038245,MachineLearningGod,Define custom LSTM Cell in Keras?,54231866,1462770
342,58001774,4790871,David Parks,Tensorflow get the default device name,58108256,9828197
343,58001774,4790871,David Parks,Tensorflow get the default device name,58157571,4790871
344,57438856,3736306,yuqli,tf.constant_initializer() vs tf.global_variables_initializer(),57440644,10400883
345,57438856,3736306,yuqli,tf.constant_initializer() vs tf.global_variables_initializer(),57441807,3987085
346,57438856,3736306,yuqli,tf.constant_initializer() vs tf.global_variables_initializer(),57440111,9393102
347,56557084,3041068,dontloo,"when restoring from a checkpoint, how can I change the data type of the parameters?",56664852,1782792
348,56006614,7766158,Nakeuh,Doing Multi-Label classification with BERT,56008069,5652313
349,55125977,6202519,Andrii Zymohliad,How to build TensorFlow Lite as a static library and link to it from a separate (CMake) project?,55144057,6202519
350,57488150,3616293,Arun,tensorflow warning for data types,57998742,3752281
351,57488150,3616293,Arun,tensorflow warning for data types,57488298,901925
352,56774103,3987085,gorjan,Dot product between two 3D tensors,56782131,901925
353,56774103,3987085,gorjan,Dot product between two 3D tensors,56774510,9274732
354,56774103,3987085,gorjan,Dot product between two 3D tensors,56774334,3275464
355,55627995,6510273,Florida Man,Keras2 ImageDataGenerator or TensorFlow tf.data?,55628807,9457030
356,55627995,6510273,Florida Man,Keras2 ImageDataGenerator or TensorFlow tf.data?,58231402,6117017
357,55627995,6510273,Florida Man,Keras2 ImageDataGenerator or TensorFlow tf.data?,55628241,5786339
358,55526797,5902558,Michael Bedford,TensorFlow object detection fails on Xamarin Android with a reshape issue,55612809,5902558
359,55303156,10249197,Jens Caasen,Keras h5 to Tensorflow serving in 2019?,55303277,3214872
360,54830869,1179925,mrgloom,Understanding tf.contrib.lite.TFLiteConverter quantization parameters,58096430,834565
361,54830869,1179925,mrgloom,Understanding tf.contrib.lite.TFLiteConverter quantization parameters,54918316,8049751
362,57349403,8100895,Jonathan,Different image dimensions during training and testing time for FCNs,57350483,1699075
363,57246091,3926152,CrazyBrazilian,How to cast int32 tensor to float32,57246186,3641067
364,55908329,4411131,o1-steve,Tensorflow - ValueError: Output tensors to a Model must be the output of a TensorFlow `Layer`,55909446,5154274
365,55532683,11303808,Emma,Why is TimeDistributed not needed in my Keras LSTM?,55533761,3584765
366,55431344,7248145,christk,Combine tf.keras.layers with Tensorflow low level API,55431562,5154274
367,57478698,290443,MikeRand,How can I make TensorFlow 2.0 handle piecewise gradients (e.g. across `tf.gather`)?,57479139,1782792
368,56896230,7850499,Maybe,Why would this dataset implementation run out of memory?,56897580,2455494
369,55577711,7156572,Sithling,Keras model.predict() slower on first iteration then gets faster,55577921,4297035
370,55455824,9662374,Th&#246;mi Mendelin,How to run TF object detection API model_main.py in evaluation mode only,55504908,8229032
371,55425811,9754177,MasterYoda,Implementing Intersection over Union Loss Using Tensorflow,55438598,5786339
372,54830126,1179925,mrgloom,What does &#39;quantization&#39; mean in interpreter.get_input_details()?,54902343,8049751
373,54575714,11028575,rsm,Combining Keras model.fit&#39;s `steps_per_epoch` with TensorFlow&#39;s Dataset API&#39;s `batch()`,54576279,1900721
374,54003848,2149707,Marumba,Custom loss function works even though dimensions mismatch,54005985,9883438
375,57846553,4028648,EmielBoss,TensorFlow: How can I inspect gradients and weights in eager execution?,57886724,5140223
376,57279754,11860666,albertNod,"What are the Tensorflow qint8, quint8, qint32, qint16, and quint16 datatypes?",57413676,11530462
377,56800910,11674382,Jeeva Bharathi,How to use trained BERT model checkpoints for prediction?,56818093,8893595
378,56800910,11674382,Jeeva Bharathi,How to use trained BERT model checkpoints for prediction?,56813001,11411463
379,55929960,8360375,ya9do,What is the best way to handle large data with Tensorflow.js and tf.Tensor?,55935943,5627599
380,55929960,8360375,ya9do,What is the best way to handle large data with Tensorflow.js and tf.Tensor?,55940423,5069957
381,55672644,4426009,Hamid Heydarian,"expected input_1 to have 3 dimensions, but got array with shape (3, 4)",56179512,3595278
382,55672644,4426009,Hamid Heydarian,"expected input_1 to have 3 dimensions, but got array with shape (3, 4)",55762386,4426009
383,55618892,3516936,Neo,"How to get number of rows, columns /dimensions of tensorflow.data.Dataset?",55620373,5154274
384,55457045,10710212,John Brown,Dropout layer directly in tensorflow: how to train?,55458070,5154274
385,55457045,10710212,John Brown,Dropout layer directly in tensorflow: how to train?,55457815,5786339
386,55375416,4844311,berkelem,Tensorflow model.fit() using a Dataset generator,55379910,4844311
387,55248631,2119562,yesman,Tensorflow can&#39;t assign a device for operation,55455490,4075155
388,55193860,3337089,Nagabhushan S N,Keras - LeakyReLU has no attribute name error when saving model,55194353,11065347
389,54606302,587021,A T,tf.data.Dataset from tf.keras.preprocessing.image.ImageDataGenerator.flow_from_directory?,54607040,2641587
390,54495686,2451763,Sparker0i,Obtain input_array and output_array items to convert model to tflite format,54499508,10878733
391,54284107,8917137,Noah,Where can I find the source code of tensorflow_lite_gpu?,54315586,10952155
392,54215981,10420509,Alberto Mart&#237;n,"tf.gradients(model.output, model.input) computes a different value each time I run it",54217911,7059474
393,54207324,10918873,llo14,"Writing this exotic NN architecture with keras, tensorflow and python",54221111,2097240
394,54165937,10712505,ml888,What exactly does tf.expand_dims do to a vector and why can results be added together even when matrix shapes are different?,54166798,7389608
395,54093950,1866775,Tobias Hermann,How to experiment with custom 2d-convolution kernels in Keras?,54095615,9883438
396,54093950,1866775,Tobias Hermann,How to experiment with custom 2d-convolution kernels in Keras?,54094836,1782792
397,57965732,7212365,zihaozhihao,Why are gradients incorrect for categorical crossentropy?,58403997,10133797
398,57851309,3504926,Paulo Ribeiro,Google Coral Edge TPU compiled model - Inference always almost the same,57931622,9867252
399,57350786,3674176,hichame.yessou,Correct Ranking Loss Implementation,57419121,5140223
400,56104861,9839954,Tina Liu,How can I validate the segment_ids argument of tf.unsorted_segments_max?,56105459,3767239
401,56069319,11478452,Daniel B.,"How to fix &quot;ValueError: Operands could not be broadcast together with shapes (2592,) (4,)&quot; in Tensorflow?",56070690,7389608
402,55648920,7560008,MerklT,Setting Keras Variables in Generator,55651130,423926
403,55421290,820833,andy,TensorFlow 2.0 Keras: How to write image summaries for TensorBoard,55754700,10886420
404,55421290,820833,andy,TensorFlow 2.0 Keras: How to write image summaries for TensorBoard,55719737,1471022
405,55220116,10285105,DeepLearner,Converting sparse tensor dense shape into an integer value in tensorflow,55220809,5154274
406,54822156,9328846,edn,tensorflow keras embedding lstm,54831550,5140223
407,54610806,7517192,Alex,tf.keras: Evaluating model.updates breaks when using a tf.data.Dataset as input,54836270,7517192
408,54520051,10322320,Val,Should I return dataset directly or should i use one_shot iterator instead?,54521758,9415153
409,54366838,6083655,ShellRox,Special function on feature maps of convolutional layer,54369774,9277245
410,54332316,5265527,Pierangelo Calanna,Running multiple tensorflow sessions subsequently,54333825,8593338
411,54332316,5265527,Pierangelo Calanna,Running multiple tensorflow sessions subsequently,54332470,1868775
412,54026623,10851981,Ralf S&#252;rig,AWS Sagemaker - ClientError: Data download failed,57010202,10824677
413,54026623,10851981,Ralf S&#252;rig,AWS Sagemaker - ClientError: Data download failed,56997160,10824677
414,54026623,10851981,Ralf S&#252;rig,AWS Sagemaker - ClientError: Data download failed,54100353,10392672
415,54026623,10851981,Ralf S&#252;rig,AWS Sagemaker - ClientError: Data download failed,54036391,4476294
416,57108959,5931672,Agustin Barrachina,How does tf.gradients manages non-holomorphic functions?,58098418,5931672
417,56910950,4790871,David Parks,Keras predict loop memory leak using tf.data.Dataset but not with a numpy array,56916421,4790871
418,55276696,8858832,Niteya Shah,Convert a variable sized numpy array to Tensorflow Tensors,56518152,472876
419,55276696,8858832,Niteya Shah,Convert a variable sized numpy array to Tensorflow Tensors,55299273,8858832
420,54652536,4166932,Matthew Conradie,"Keras (Tensorflow backend) Error - Tensor input_1:0, specified in either feed_devices or fetch_devices was not found in the Graph",54672965,4166932
421,55106805,6714608,ABCD,tf.loadModel is not a function,56083801,8860764
422,55106805,6714608,ABCD,tf.loadModel is not a function,55107561,5597718
423,55908188,1269281,bachr,This model has not yet been built error on model.summary(),57176122,8375120
424,55908188,1269281,bachr,This model has not yet been built error on model.summary(),55909624,5154274
425,55322754,867889,y.selivonchyk,How to do weight initialization by Xavier rule in Tensorflow 2.0?,55324360,2891324
426,55322754,867889,y.selivonchyk,How to do weight initialization by Xavier rule in Tensorflow 2.0?,55323065,3987085
427,55236063,11043686,Ayush Kushwaha,AttributeError: module &#39;tensorflow&#39; has no attribute &#39;get_default_graph&#39;,57791552,11708503
428,55236063,11043686,Ayush Kushwaha,AttributeError: module &#39;tensorflow&#39; has no attribute &#39;get_default_graph&#39;,57764121,11708503
429,55236063,11043686,Ayush Kushwaha,AttributeError: module &#39;tensorflow&#39; has no attribute &#39;get_default_graph&#39;,55887429,10353697
430,54913830,6197534,Glen E. Renner,what&#39;s the difference between &quot;import keras&quot; and &quot;import tensorflow.keras&quot;,54914559,5786339
431,54836522,2543622,user2543622,keras understanding Word Embedding Layer,54868404,2097240
432,54440226,5048010,Gianluca Micchi,Using TFRecords with keras,54440703,5495381
433,54440226,5048010,Gianluca Micchi,Using TFRecords with keras,54440635,2641587
434,56340158,9144990,mrzo,Select from a 3-dimensional array with a 2-dimensional array,56341613,7389608
435,56340158,9144990,mrzo,Select from a 3-dimensional array with a 2-dimensional array,56340250,9698684
436,56340158,9144990,mrzo,Select from a 3-dimensional array with a 2-dimensional array,56340373,1782792
437,56340158,9144990,mrzo,Select from a 3-dimensional array with a 2-dimensional array,56340303,11015427
438,55434653,1930737,Aviv Moshe Albeg,Batch Normalization doesn&#39;t have gradient in tensorflow 2.0?,55436103,9393102
439,55424906,8100895,Jonathan,Building SVM with tensorflow&#39;s LinearClassifier and Panda&#39;s Dataframes,55505963,423926
440,55424906,8100895,Jonathan,Building SVM with tensorflow&#39;s LinearClassifier and Panda&#39;s Dataframes,55473205,7985142
441,55324762,11037865,Rstynbl,The added layer must be an instance of class Layer. Found: &lt;tensorflow.python.keras.engine.input_layer.InputLayer object at 0x000001FA104CBB70&gt;,58191504,6036772
